Kalamang_Sentence,English_Translation
Manado bo warta magaripta eba ma luk.,Manado went fishing and came back at sunset.
Sontum mumahap owangga ra rapat.,Everyone went there to meet.
Mariyam me namun Mahem.,Mariyam's husband is from Fakfak.
Kewe ma me main.,That's his house.
Sor wa me mais.,This fish is spoiled.
Tanggor me mal reidak.,There are many rabbitfish at Tanggor.
Tumtum epka wa me malaimangsaet.,The kids these days just speak Indonesian.
In Mustafa esun rewet malamat paruo.,We went to get Mustafa's father to read the Thursday prayers.
Irjan esun fiberunat malaoukte lamutkaware.,Irjan's father turned over his fibre boat to scrape off the algae.
Mat malelinde geǃ,Keep it still already!
Gosaunet me maliap arepnerga mararet me ebon.,In the evening the golden rabbitfish enter the bay in schools.
In erat maling tanbeskinat korotrot.,We moved the canoe on its side to slice the left side.
Malkesi me ram nerunggo reidak.,"Of rabbitfish, there are many in the soft coral."
Burhan me Tami esunat gonggunget me mama.,Burhan calls Tami's father uncle.
Rajiba Riska esunat gonggunget me mama caun.,Rajiba calls Riska's father uncle.
Ruslan ma Nadia esunat gonggunget me mama temun.,Ruslan calls Nadia's father uncle.
Bayu esun et mulko mambaran.,Bayu's father stands next to the canoe.
Rajia emun me warun mambon.,Rajia's mother has coconuts.
Sor mambon ye saerak?,Is there fish or not?
Wiseme Mamikaca kon watko ma ma he bot.,"Before, there was a Mamika/Kokonau person here but he left"
Mamor me Suo me reidak.,At Suo there are many hornbills.
Manadu mu Pakpao parinda tumpuk konde ripi purap.,Taros they sell at Fakfak: one heap fifty thousand (rupiah).
Randa emun kofirat gareorta mang.,Randa's mother served bitter coffee.
Wise me mu nasulaet me malikan mangmanggat napakiet.,"Before, if they danced, they had to use the gong."
"Tami emun mu sorat anda, an tok manggang.","Tami's mother gave me fish, I'm hanging it up first."
Irjan dunun cicaun se garen.,Irjan's little sister already crawls.
Maniktapuri Werneti osaet me mambon.,Up at Werneti there are crowned pigeons.
Et newasta Dian taraun marua manyuor.,Dian's grandfather goes seawards to adjust the stranded canoe.
Onin esun mu keweun sengunara maorek.,Onin's father and family break down their house's roof.
Ngais muapta sor kangun minunggo langgourta muaunat maouk.,"Ngais ate, a fish bone got stuck in her throat, she spit out her food."
Bakri taraun pasa maraok eba na.,"Bakri's grandfather crushes his rice, then eats."
Binkur esun sadawaunat watko maraouk ma koi bo tompat kabasko sanggara.,"Binkur's father stored his machete here, then he went to look (for it) somewhere else."
An erara mararak.,I'm putting the canoe on land.
Nina Ruslan taraun me liti marau kon tanunggo.,Granny Ruslan's grandmother has a golden bracelet on her arm.
Tami emun Tomi kieun Mayor kieun me loska marmar.,"Tami's mother, Tomi's wife and Mayor's wife are walking to the dock."
Bakri emun anat marok ma toni sor saerak ba mambon.,"Bakri's mother fooled me, she said there is no fish but there is."
Alam emun mu distrikara marua.,Alam's mother and family go seawards from the mainland.
Tami emun welemarum deba.,Tami's mother is slicing vegetables.
Nabil marur mat paruo.,Nabil is plagued by mucus.
Mas me osun iriskapte.,Mas has a white beach.
Randa emun mu dodon masa reba.,Randa's mother and family are drying clothes.
Makassarsontum lukte masal narun paruo reba.,A Makassarese came to work with flying fish eggs.
Unyil esun sadawak man masalaboung deba.,Unyil's father is cutting off the end of the machete handle.
Banda wilakara marmari masara.,Banda walks from the sea landwards.
Laka kieun padamualmasarut.,Laka's wife is tearing pandanus leaf.
Rahman masawin mat koraruo.,Rahman was bitten by a centipede.
Kisileng se bo torasunsaet pi komei sara maser reidak.,The sky is very clear; we look up and there are many stars.
Kalis ourta masinul bo kewe nerunggo.,"It rains, dew (damp) comes into the houses."
"Mustafa esun mu Masko gomasir, lek amdirun.","Mustafa's father and friends are weeding at Mas, (at) the goat's garden."
Sungsungan kareun se bo masok.,My pant's rope is tied too tight.
Kadera masoki meiǃ,Shove the chair over here!
Mata sontum mahara.,A person from Fakfak is coming.
Gosaunet me mata dimdim tanisa kerunggo reidak.,In the evening there are many fireflies in the tanisa plant.
Dela esun bo warta matan senara ramie.,Dela's father goes fishing and catches a matan sena fish.
Tamandi Arel sepedaunat matur.,Tamandi caused Arel's bike to fall.
Ladan wa me kainun mawal.,This shirt's cloth is thick.
An minda ur koukoura an narasa mawin.,"I sleep, the wind blows and I feel good."
Tamandi emun sor sirara mayilma.,Tamandi's mother is flipping salted fish.
Ladan me rasa.,That shirt is nice.
Pi wa me soui reba.,"As for us here, we just slide."
Kibiska bo wilaoet me mel puraman?,From the shore to the sea how many miles is it?
Sikan sara Kalamang emun melebor.,A cate came up and Kalamang's mother got rid of it.
Esa desa mu melalu garung.,The village head's family sat chatting.
Mena muat metko nawanggarte.,Later wait for them there.
Suolca he bes? O bes mera.,"Is your back fine again? Oh, of course it is."
Rustam taraun merar kon kanggir pulunggo.,Rustam's grandmother has a mole on her eyelid.
Kiba esun warat Kuea merengguen.,Kiba's father is collecting coconuts at Kuek.
Bobi taraun me mesanun tok saerak.,Bobi's grandfather's gravestone isn't there yet.
Saya sor mesangunat di kolko.,I take away the fish's gills.
Pasa wa me in nara mesang.,This rice tastes like pulp.
Ror tem ma me he metko.,A tree stem is lying there.
Mena pak eir Elinbon esunbon se koi mia.,"Later, in February, Eline and her father come."
An ladananat miabesi paruotkin.,I want to make that many clothes for myself.
Tumun se bo teimun miarip.,The kid has become this big.
Kalis bara tong inggon se bo mikon.,"The rain falls, our barrel is full."
Hawa tumunun se min.,Hawa's child sleeps.
Minan ning.,My liver/adam's apple/throat hurts.
Kalamang emun toni ma perat nanet me minarun ning.,Kalamang's mother says if she drinks water her adam's apple hurts.
Faisal emun me mindi don bolonet me ma he kademor.,"Faisal's mother is like that, if there is a small thing she is mad."
Faisal emun mua mingparin.,Faisal's mother and family sell oil.
Minggalorun me kotur.,His sleeping area is dirty.
Unyil esun me minet me ma he minggaruk.,"Unyil's father, if he sleeps, he snores."
Manado mu he serie Mayor kokok mintolma.,Manado and his family ordered Mayor to slaughter a chicken.
Ladeka tumunun misilmisil kerunggo gare.,Ladeka's child is crawlying on the cement floor.
Suci mok nerunggoa perna.,Suci drinks water from a mug.
Tami esun bo rompunggara momarat goyang.,Tami's father goes to the floating fish lure to shake momar fish (to use as bait).
Nabil esun me fiberun mon.,Nabil's father has a quick fibre boat.
Wie yume tok mor.,That mango is still sour.
An sorat pasor ba an tok mormor.,I fried fish but I still hide it.
Wa me se mosun sayang.,This is nutmeg season.
Mu distrikara marua.,They come from the mainland.
Dalima sara mijie ba Sakina mu tok muap.,Dalima goes up to buy noodles but Sakina and family are still eating.
Kiaba me muap sabur reidak.,At Kiaba there are many sago trees.
Muap sabur kunun bolodak.,There is just a little bit of sago flour.
Muap sabur sangganun me reidak.,There are many sago grubs.
"Mu Randa emun mukonggo muawaruo, rorap teirkinde.","They are cooking at Randa's mother's, they are making a foundation."
Tumtum yargi wiat mudi.,The kids are throwing stones at the mangos.
Tompat ma me muin.,That is their place.
Mu kolaka bore yecie mu he muisese.,"They come back from the mountain, they are hungry."
Mustafa esuna mojin.,Mustafa's father is the muezzin.
Dian taraun bo wienara muk teba.,Dian's grandmother is going to throw a fishing line.
Salima mambara kadenunara muk.,Salima stands rocking her body.
Jikri mu bo sarim mukmuk teba.,Jikri and his friends go rock the guava.
Mulerca ning.,Your waist is ill.
Mulun owanggara ma mara.,He comes from that side.
Sor yume se mun.,This fish is rotten.
Faisal emun mu me mun reidak.,Faisal's mother has many limes.
Sundus kieun me mun reidak.,Sundus' wife has many lice.
Kamun koyalin!,Don't touch!
Anan mun sunsun mambon.,I have nits.
Kalamang esun mu Munak osatko.,Kalamang's father and family are up at Munak.
Moktar mu muninggara bo sayangsara.,Moktar and family went to the west side to harvest nutmeg.
In Parar muninunggo botkin.,We want to go to the westside of Fatar.
Unyil mu munmun owatko.,Unyil and family are searching for fleas over there.
In taramur pangga erare.,We went up to the forefathers' peak.
Muradik tumununa kon.,The imperial pidgeon has one chick.
Lempuang tumun me murkumkum metko amkeit.,On the small island a pigeon laid eggs.
Mursambuk etkon lalat.,An imperion pidgeon died.
Musing me kunun iriskap.,The leopard torpedo has white flesh.
Mustika me watko saerak.,There are no pearl-shells here.
Pi timunat kowarman.,We break off the tips.
Ketanana wa esanana wa.,"This is my parent in law, this is my father."
An kukisara na.,I'm eating cake.
Sikan don met naberuai bara.,The cat is dropping that thing.
"Nabestai bot eh, kirim salam muonggo!","Be careful on your way, greet at home!"
Sontum Utun me muraina kadoat nadadi.,Butonese people weave their own sarongs.
Bayu esun Bayuat nafafat.,Bayu's father slaps Bayu.
Mayor nafikir leng wa me beset.,Mayor thinks this village is good.
Pasa jatat mu yapta tok naharen.,The divided the rice and there were leftovers.
Naiar me watko saerak.,There are no lontar palms here.
Rukmana emun tumunun cicaun kaborun nakabung.,Rukmana's mother's small child has stomach cramps.
Suci emun nakal ning deba.,Suci's mother has a headache.
Halim tumunun nakal pokpok tok karanin.,Halim's kid's fontanelle isn't hard yet.
Jafaris me toni ladanun me nakacuk teba.,"Jafaris said he wants to rub his shirt. (He wants to wash without using a brush, just by rubbing.)"
In kapasat jien eba perko nakucak.,We get cotton and then rub it in water.
Unyil emun Unyil esunat korunat naladur.,Unyil's mother massages Unyil's father's foot.
Rustam kokoun nalat.,Rustam's chicken is dead.
Salima emun lenggalengga naloli minggi sor kuarkin.,"Salima's mother is pestling chilli, she wants to cook fish with that."
Kaliset me Aina emun kewe anggasun me per nam.,If it rains the water in front of Aina's mother's house puddles.
Tamandi emun toni ma sor met namakin.,Tamandi's mother said she was creeped out by that fish.
"Naman ba me? Geo, Kalamang mu ba.","Who's that? Oh, just Kalamang and family."
Emumur lepalepanggi yali namasawuot.,The women are racing in small wooden canoes.
Saleha se namgon.,Saleha is married.
Dalimabon Salimabon naras Nazua namot.,Dalima and Salima were fighting and Nazua blocked them.
Tuti emun namun cauna Dela esun.,Tuti's second husband is Dela's father.
Nabil emun Dian emun tumununat namusi.,Nabil's mother is kissing Dian's mother's child.
Bobinan Pakpaka bot.,Bobi went to Fakfak too.
Malaikat ba kierat nanetkon o!,Get lost you two! (Lit. May the angel of death eat you two!)
Pianinggana he yonsongat koluk.,We had all gotten a motor.
Tumtum narabir.,The kids are making noise.
Sikan eira naras.,Two cats are fighting.
Davit emun pasa narawi.,Davit's mother is filtering rice.
Enem desa ma sayang narekin deba.,The village head's wife counting nutmegs.
An erat masakte nares.,"I'm lifting a canoe, it's too heavy."
Ma kanggusunat naroman.,He leans his chin in his hands.
Mama leba mu pawan narorar teba.,Uncle imam and family are dragging planks.
Ma borani narorik.,He ran aground first.
Kokok narun saerak.,There are no chicken eggs.
Kewe me tok nasalen.,That house is still open.
Rustam tok nasaliknin.,Rustam isn't circumcised yet.
Pak tolasta me tumtum nasambiande mososor.,In the fasting month the kids are diligent with going to the mosque.
Mayor kieun ma kadera kerunggo melalu nasandar.,Mayor's wife sits leaning on a chair.
Bilal esun mu Tamisengga bara tiri nasangginggir.,Bilal's father's family are going down to Antalisa sailing close to the coast.
Citra ma marmarta eba Ngais kareat naseduk ma tur.,"Citra was walking, then Ngais pulled a rope and she fell."
Kalamang me nasek ma tolasnin.,"Kalamang broke his fast, he isn't fasting."
Warkin nasesakta ror temtem pouk.,When it's high tide tree stems float.
Tumtum Rajiba taraun konggoa nasibur.,The kids are reciting at Rajiba's grandfather.
"Ma kadenunat muk, naunun nasuarik.","He shook his body, his soil scattered."
Ruslan taraun ma kalifan nasuat.,Ruslan's grandmother is tucking in a mat.
Tomi kieun kofirat gareorkin ba nasuena saerak.,Tomi's wife wants to serve coffee but there is no sugar.
Mu tiriat puera sontum nasula.,They hit the drum and people danced.
Kalis barara an per natada.,"The rain is falling, I'm collecting water."
Mu nautu.,They are hitting each other.
Dian esun et nauanona reba.,Dian's father is balancing the canoe.
Riski emun mu distrio nauhalar.,Riski's mother and family are marrying on the mainland.
Mu perusahanggoa nauleluk.,They meet each other on the mainland.
Tat me naun ten.,Tat has bad soil.
Naun kerkap sikola kerun me.,Above the school there is red soil.
"Ma urawat komahal, ka tok mat naunakte.","He doesn't know the way, you show him."
Mu warara naunin.,They are marking coconuts.
Opa naupar me kalis bara.,This morning it rained.
Hairul yonsongat kinkinde tiri naurar.,Hairul is steering the motor boat sailing around.
Wiseme mu toni Japangbon Beladarbon nausair.,"Before, they said Japan and The Netherlands were at war."
Salima emun weleat nawan weinun.,Salima's mother is serving vegetables again.
Mustafa esun mu amdirga botkin mu tok Sakinat nawanggar.,"Mustafa's father and family want to go to the garden, they are still waiting for Sakina."
Bakri emun min ba Desi mat nawarar.,Bakri's mother sleeps but Desi woke her up.
Rajia emun kukis nawerar teba.,Rajia's mother is making pastry.
Marain keweun osane nawanona.,He himself tidied his house up there.
Nebasora natuka?,What kind of fish is pecking?
"Nebaunara ka he narasaet, pasa opa me...","If you tasted its whatsit, that rice..."
Kamun koi nebain!,Don't you whatsit again!
"Nebara paruo? Ge, o...","What are you doing? Oh, nothing..."
Walaka me nebir reidak.,At Gorom there are many nebir fish.
Bak sekolao me per neko.,There is water inside the container at school.
Ibu me ririnun anat nemies.,Miss's length exceeds mine.
Mena go ginggirta me nene se ewa.,When it's late afternoon the cicadas make their sound.
Kewe nerun sausaun.,The inside of the room is dark.
"Mei, ge, kewe nerunggo melalu.","Come one, sit inside the room."
Ror sieun ma me he newa.,The edge of the piece of wood fits.
Et owa me newas.,The canoe over there is stranded.
An se uranan Sakina mukonggoat newer.,I already paid my debt at Sakina's.
Manado bo nika jie reba.,Manado goes to buy fishing line.
Nina ma kadenun lalang.,Grandmother has a fever.
Pak guru Marlan gierun ning.,Teacher Marlan has a sore tooth.
"Gustami mu mat koewara, ma nokin.","Gustami and his friends are mad at him, he is silent."
Mier melalu noknok.,They sit whispering.
Nop leng wa me saerak.,There is no nop-bamboo in this village.
Yusra emun mat tura ma bo nung.,"Yusra's mother hit him, he goes to hide."
"Kanggirun se nunun, kamun mat koyalin.","She closed her eyes, don't you disturb her."
Yarkinkinbon supaya kalisero me mamun raparin to.,[Make it] with small stones so that if it rains it doesn't become too packed.
Irul emun me ofin paning deba Mustafa kongga.,Irul's mother is ordering an oven with Mustafa's.
An kalis perara olol.,I collect rainwater.
Opa kalis bara temun.,Earlier it rained hard.
Tumun opa sorat parein.,That kid sells fish.
Opa yuane mu Nyong esun mu keweunat seng paku.,Today they nailed Nyong's father's family's roof.
Davit esun serie Dian esun et orunat potma.,Davit's father ordered Dian's father to cut the stern of the canoe.
Orasat pi komeret.,We watch the time.
Laka kieun bo warta oronggos ramie reba.,Laka's wife went fishing and caught a redtoothed triggerfish.
Sontum lenget bo os iyarte minggi taloara paruotkin.,"People from the village went to get sand, they wanted to make a seawall? with it."
Os barikbarik me talok mulun me mambon.,At the seawall? there are nerite shells.
Kambur osep me osun barsi.,The Kambur beach has clean sand.
In kolaka bora marmari era in tok osie.,"We went up the hill, we rested first."
Mama leba mu Kambur oskitka mara.,Uncle imam and family went on land at Kambur beach.
Inininggan tebonggan bo Kambur oskol metkoa robaherkiem.,We all went to the beach edge of Kambur to bathe.
Los sieun me os marera reidak.,There are many wrasses at the edge of the dock.
Ospulpul me set maoyet.,The ospulpulfish finished the bait.
"Kalis our terus, daruon saun.","It rained on and on, from midday to the evening."
Pabalet reidak didirasko.,There are many flies in the kitchen.
Madi emun ma kiemat pabie.,Madi's mother is carrying a basket.
Wowa Ruslan emun ma padamual rep teba.,Aunt Ruslan's mother is getting pandanus.
Sontum Pakpaka mahara lampur padenunara usar eba lampurat napasang.,People from Fakfak came to install lampposts and then installed lamps.
Mu paden taburunara usar.,They install the king post.
Padewaden se kap.,The poles are rotten.
"Paer watko saerak, Gowienet me mambon.","There are no venus clams here, at Gowien there are."
"Mester kanggirun warum nekora, mu pahermara eba mu kou.","Mester had dirt in his eye, they opened it and blowed."
Paisor wilao yume kuat.,The current in the sea there is strong.
Paisor kesun lempuang emun me mambon.,There is spiral coral at Lempuang Emun.
Randa emun buok pak teba.,Randa's mother is chewing betel.
Dilurpak me tok yuon lalang ba pak yuane kalis se ur.,"In the fourth Islamic month the sun is still hot, but this month it's already raining."
Tanggor me sor pak me mambon.,In the mangrove there are moonfish.
Wer me pak arkon metko.,At Wer there as one pak plant.
Pak tubak.,It's a full moon.
Nabil balungun pakmang.,Nabil's balloon exploded.
Kalamang esun Pakpakara bot.,Kalamang's father went to Fakfak.
Palang arkon kanai kerunggo.,There is a bird's nest fern in the pili nut tree.
Urap me me palawak.,That street is slippery.
An kanggaranat palen.,I'm tying a bamboo floor.
Pandoki sanongara Bulat emun mu gaim.,Bulat's mother and family are sewing a nypa palm roof.
Pang osanggara in era lampur kewengga.,We go up to the summit ther to the lamp house.
Panggal me os tumun me mambon.,At the small beach there are spider conches.
Roti wa me he panggalan.,This bread is already swollen.
Panggala besten me Sakina mu amdirun me mambon.,Good cassava is in Sakina's family's garden.
Loi panggare!,Walk quickly!
Panggawangga me lenggo saerak.,There are no leeches in the village.
"Panggut ma me namankin? Ge o, Binkur esunkin.","Who's tool is this? Oh, just Binkur's father's."
Irul wat paning deba.,Irul is asking for coconut.
Bilal emun Baubaungga bora. Rajia emun komporat panok.,Bilal's mother is going to Baubau. Rajia's mother ordered a stove.
Mu panoat gerket nauhalarkin.,They asked for permission to marry.
Arifin Jido panok micaun tumtumunat nasalin.,Arifin Jido confirmed the circumcision of his child.
Suryan emun mu Walakangga botkinda mu marmarte naupanokpanok.,"Suryan's mother and family want to go to Gorom, they are walking around asking for permission to leave."
Panpan me Suo me reidak.,At Suo there are many limpet shells.
Distrik me kalis wandiet me se bo paos.,"On the mainland, if it rains like this everything turns into mud."
Kahamin parai me go saunet ma ewaet.,"The owl, when it's evening, hoots."
Tami emun me sor sira parair teba.,Tami's mother is splitting fish to dry.
Paramuang me watko saerak.,There are no crocodiles here.
Nyong esun keweunara paran.,Nyong's father makes the walls of his house.
Yahya mu amdirun me paransik.,Yahya and family's garden is closeby.
Bakri taraun se parar.,Bakri's grandfather is already awake.
In langganat oskitka pararani mara.,We extend wooden beams from the beach to inland.
Fitri kalifan parara.,Fitri extends the mat.
Din paras wa me pi keteles sairet me.,These embers would be good for baking maize.
Sakina emun mu amdirga bora manan muat parair.,"Sakina's mother and family are going to the garden, she (Sakina) also joins."
Randabon Nazuabon naras. Randa Nazuat paritman.,Randa and Nuzua were fighting. Randa scratched Nazua.
Esnem desa mu Mayor mu paror kerunggoa melalu.,The village head's family sit in front of Mayor's family's house.
Supri emun wele parua reba.,Supri's mother is picking vegetables.
Esa temun et mulunat potma paruak.,Uncle cuts the side of the canoe.
"Sor ma me gawarta, Nabil emun se paruak.","That fish was rotten, Nabil's mother threw it away."
"Kahamin sorat paruak, bal se mat nan.","The bird dropped the fish, the dog ate it."
Kokok yume parun kawarcie.,That chicken has a broken wing.
Mu tok keweat paruotnin.,They haven't made a house yet.
Mu tamanggara paruok? Etkitka.,Where did they exit from? From the boat.
Pasa jata tok maharatnin.,The government rice hasn't arrived yet.
Pasarom me naman mukin?,Who's ambarella is that?
Pasiem me Sakina mu me mambon.,At Sakina's there are yellow taros.
Moktar esun pasienggara bot.,Moktar's father went to the toilet.
Ka tok tumtumat pasiepteǃ,"You, expel the kids!"
"""Ur temun?"" ""Ge, pasier upǃ""","""Was the sea rough?"" ""No, the sea was calm!"""
Per masikit kirarunggo me pasirwasir.,The water next to the mosque is brackish.
Hami emun se paskot.,Hami's mother is a widow.
Abdulah emun im pasor teba.,Abdulah's mother is frying banana.
Amin esun mu Kiabangga marua watko pasparin maraouk.,Amin's father and family came from Kiaba to give the bride price.
An Burhan sungsungara melalu pat.,I'm sitting sewing Burhan's trousers.
Ma komaini bo korpatinunat kosara.,"She threw it, it hit her wounded leg."
Patin ter kon Mayor kieun tanunggo.,Mayor's wife has a scar on her hand.
Wise me nina anggon mu imat pau.,"Before, my grandmother cooked bananas in an earth oven."
Wise me mu pauat paruo.,"Before, they made earth ovens."
Binkur esun mu bat paruo ba pawan saerak.,Binkur's father and friends are making a container but there are no planks.
Burhan mu bo os payiem deba minggi bat paruotkin.,"Burhan and they are getting sand, they want to make a container with that."
Kindius me pearip kon metko.,At Kindius is a water pool.
Pebis ma me tamanggara luk?,"That women, where did she come from?"
Mu imat pel.,They cut the bananas.
Im me pel puraman?,How many bunches of banana is that?
Tarar me gosaunet me pelelu kuat.,"At Tarar, in the evening the cold wind is strong."
Ter wa me tok penin.,This tea is not sweet yet.
Penyakit kat nanetkon!,May an illness eat you!
Per natkin saerak.,There is no drinking water.
Ma per iriskap na reba.,She's just drinking water.
Ka per kerkap natkin deba ye kofir?,Do you want to drink tea or coffee?
Per kuskap saerak.,There is no coffee.
Per natawarten met mare ge.,"Give her that holy water, no?"
Per Unyil mukonggo me per pasirwasir.,The water at Unyil's is brackish.
Mu perbol taikon owatko.,They are at the river bank over there.
Manado mu bo perkio war.,Manadu and friends go fishing at the waterfall.
Citra etua ba pertamun taluknin.,Citra is crying but her tears aren't coming out.
Dalima pesawesaun temunat Irjan emun mu napinjang.,Dalima borrows a big spatula from Irjan's mother.
Pes gedung mulunggo me reidak.,There is a lot of trash next to the village building.
Wise me mu dodonat di peti nerunggo.,"Before, they put their clothing in a box."
Pi bo nebara paruotkin?,What are we going to do?
Pitis me pin.,That money is ours.
Pingan me losing puraman?,How many dozen plates is that?
Os met di tawirpis metkora merengguendar.,Gather that sand on that side!
Kalamang esun mu pitis nasarenun.,Kalamang's father's family have change.
Unyil mu po parin deba.,Unyil and family are selling breadfruit.
Muklis esun me pore kabaruap marok.,Muklis' father is anchored fishing for grouper.
Poar me kat neneret me mambon.,There are nerite shells inside the lake.
Neba polun? Taberak polun.,What kind of sap? Jackfruit sap.
Nazua emun kukisat potmara polas ememun.,Nazua's mother is cutting cake in big chunks.
Porkang Bakri mu keweun kirarunggo me kabaruap neko.,In the hole next to Bakri's family's house are groupers.
Tektek turi poska bara.,The knife fell down into the hole.
Posiwosi namankin?,Who's spear is that?
Bakri esun lot potma reba.,Bakri's father is cutting sinkers.
Unyil esun potporat komain.,Unyil's father stabbed a blue-spotted stingray.
Dorom kona poukta owa.,A drum floats over there.
Nyong esun Apriliara poup.,Nyong's father carries Aprilia.
Abdula emun mu Pourgara bot.,Abdula's mother and family went to Faor.
Powar me leng wa me saerak.,There are no horn shells in this village.
Mena an kat puet me ka lalat.,When I hit you you're dead.
Marni sor me pulun met potmar ye?,suruh plural but address only one speaker.
Som yu me kanggirun pulem-pulem.,That person is blinking with their eyes.
Pulkiet me munin me mambon.,On the west side of the island there is betel stem.
Tuma Onat pulma.,Tuma pinched Ona.
Juairia taraun mua ba pulorat parin.,Juairia's grandmother's family sell betel vine.
Pulpul narun sarim olunggo.,There are butterfly eggs on the guava leaf.
Pesawat wayarun naurarte bo pulpulkon.,The propeller of the plane was whirling.
Pulseka wat olunat na.,The grasshopper eats coconut leaf.
Pur wa me Randa emun Pakpakara jie.,"This betel fruit, Randa's mother bought it from Fakfak."
Wat ma me nak puraman?,How many coconuts are that?
Wat ma me tebonggan nak purap.,That are fifty cococnuts in total.
Bestalan purarar.,My hair is messy.
Manadu wa me nak purir.,These are twenty taros.
Sayang ma me purirbakon.,That are twenty-one nutmegs.
Bakri emun dondon waruo ba sabur se pus se bo...,Bakri's mother is washing clothes and the soap foams a lot.
Jikri pusirat paruo minggi bo sor karopkin.,"Jikri is making a bow, he wants to shoot fish with that."
Put puraman? Yeso.,How many tens? I don't know.
