Kalamang_Sentence,English_Translation
Tumtum loskerunggo kamuamual marok teba.,The kids are fishing needlefish from the dock.
Esa me he kamun.,Father is a widower.
Kamung sakarip se gosomin.,The iron of the dibble stick is gone.
Kanaisasen epbon.,A school of striped fish.
Nyong esun mu Kanstanganggoa kibi paruo.,Nyong's mother and they are processing sea cucumbers at Kanastangan.
"Sor me kangun reidak, an sukanangge.","That fish has a lot of bones, I don't like it."
Mayor sadawaun me kang.,Mayor's machete is sharp.
Mun kanguna Dalimat komain.,A lime thorn pricked Dalima.
Arlan taraun kanggaranpale reba.,Arlan's grandfather is weaving a bamboo floor.
Tamandia pasierko kanggeit.,Tamandi is playing in the sea.
Kanggirun patin.,She has a wound on her eye.
Ma kanggir nenen mawal.,He has thick eyelashes.
"Go he saun, Dalima he kanggir pop.","It's evening, Dalima is tired."
Suci kanggir pulun patin.,Suci has a wound on her eyelid.
Tumun yumene kanggirun saun.,That kid is blind.
Jawawas yumene kanggirar laus bolon.,That Javanese woman has a slightly broad face.
Rajiba emun kanggir narun ning.,Rajiba's mother's eyeball hurts.
Fit pasat kuarta kangguar.,Fit cooked rice (but) it's undercooked.
Nazuwa kanggurun temun.,Nuzuwa has a big mouth.
"Mayor muawi koyet, ma kanggursau reba.","Mayor has finished eating, he's rinsing his mouth."
Nostal et kanggurunara desil.,Nostal is planing the inside of the canoe.
An ketelesat nara kanggusan nauware.,"I'm eating maize, my jaw is tired."
Madi emun kiemkangjie.,Madi's mother is sewing the rim of a basket.
Ngais turta kor kangun nerunggo ning.,"Ngais fell, the inside of her leg bone hurts."
Hukat kon anggon yua me paruo dongdongkaning.,"This fishnet of mine, make it very tense."
"Kokok tumtum et putkon ba etkon lalat, tok et kaninggonie.","There were ten chicks, but one died, there are still nine."
Kanung me ma kat nenekoa tua.,The tortoise lives inside a lake.
Esa anggon me kanusun se raman.,My father already has six ancestors.
Sara bo kanyuotkowar teba.,Sara is diving for clams
Ladanan ma me he kap.,My shirt is rotten.
Ya olun lenggalenggainggap.,Its leaves are like chili's leaves.
Wiseme in tok kinkinun me kapal rorjie in tok wa ba kona.,"Before when we were still young, we went to watch the ship that came to buy wood."
Kapapet me kewe sabarak inggon me reidak.,There are many glassy sweepers under our house.
Som yume kapis mat na.,That person is suffering from scabies.
Et me karainkin ye?,Is that your own canoe?
Supri esun kewekarajang deba.,Supri's father is building a house.
Ma donpaningde kuat ba ma karamesnin.,"He's always asking for stuff, he isn't shy."
Ror wa me karan.,That wood is hard.
Panggala yuwa me karaok.,This cassava is crushed.
Dian emun me kadenun temun ba ma he karaonggis.,Dian's mother had a big body but she's thin again.
Karek mat kokarap.,The rope is wrapped around it.
Karariem epkona ram neko.,There is a school of surgeonfish in the coral.
In metko mambarar kip mengga tiri mia in kararu.,"We were standing there, a snake came slithering, we ran off."
"Burhan sarimat sarara, karabar reidak.","Burhan climbed the guava, there were many red ants."
Musim kemanur me kareng se mambon.,When it is west wind season there are frogs.
Bobi emun sortupta karer korek.,"Bobi's mother is poisoning fish, the karer fish died."
Esnem desa rorat wuorma eba ma karok.,"The village head cut down a tree, then he cut off the branches."
Wie ime karoun ur koura ma kawarcie.,"That mango, the wind blew and its branch broke off."
Halima rusat karop.,Halima shot a deer with an arrow.
Tanisa kerung me saunet me karop reidak.,"In the tanisa tree, when it's evening there are many fireflies."
Mena se go girgriet me karop-karop se ewa.,Later in the afternoon the bee-eaters call.
Dian taraun bo warkin ba ma tok kararjie reba.,Dian's grandmother wanted to go fishing but she went collecting hermit crabs first.
An sorat karuar.,I smoke-dry fish.
An sorat karuoi sair.,I bake three fish.
Sakina tanun tektek kosara karyak.,"A knife hit Sakina's hand, there was blood."
Mustafa emun mu kasabiti reidak.,Mustafa's mother and family have many squashes.
Irjan esun kasalong kein deba.,Irjan's father is making a two-pointed spear.
Kasamina ewa.,The bird is calling.
Gowien me kasawari reidak.,At Gowien there are many cassowary's.
Lamani esun rorara kasep.,Lamani's father is marking wood.
Suagi laurta kaskas bara kanggeit.,The tuna play at the water surface; the seagulls come down to play (i.e. eat).
Abdula emun kasomkararma reba.,Abdula's mother is breaking tusk shells.
An kasorara kaware naramaste na.,"I'm scraping merbau tree, squeezing and drinking it."
Kasur in bo Tamisengga nahalarkin Anafia mu.,Tomorrow we go to Antalisa to marry Anafia and spouse.
Malik mu bo kasutpotma reba.,Malik and family are cutting bamboo.
Namandar katka ra in bo war.,To Namandar Lake we go fishing
Jikri kataperor potma reba.,Jikri is cutting a catapult.
Bobi mu bo katawenggawuorma reba.,Bobi and family are gone to cut down a forest breadfruit.
Makassarsontum kaulat wuorma.,A Makassarese cut down a betel palm.
Kawul me Gowiena reidak.,There are many betel palms at Gowien.
Sar oskeit me kawalawalan me reidak.,At Sar beach there are many kawalawalan trees.
Tomi emun wiendeirta kawaramat ramie.,Tomi's mother caught a triggerfish while linefishing.
Binkur esun me sadawaun se kawarcie.,Binkur's father's machete broke.
Kawarsuop yar nerunggo.,There's an eel in the stone.
Kalamang esun mu walorkawat reitkon.,Kalamang's father's family have one hundred coconut leaf stems.
Rustam ma waruotkin ba ma narasa kawes.,Rustam wanted to bathe but he feld cold.
Nazuwa emun melalu dodonkawetkawet reba.,Nazuwa's mother sits folding clothes.
Go lalangda Sakina melalu kadenunat kawiawi.,"It was hot, Sakina sat fanning her body."
Afdal kawier koetuare jietkin.,Afdal cried to buy a hat.
Sontum kawirten hari minggu gerejao nasumbiyan.,Christians worship at the church on Sunday.
Nostal wiekawotma reba.,Nostal is peeling a mango tree.
Nabil emun mu kawuokjie bubirkuarte di tumtumgin.,Nabil's mother and friends buy beans to cook porridge to give to the kids.
Gani mu gous repte kayakat paruotkin deba.,"Gani and family get bamboo, they want to make a bamboo wall."
Kedederet Sakina mu lenggalenggaunat na.,A black bird at Sakina's family's chilli.
Ma kahalonggein potma reba.,He is cutting a spear handle.
Keirkeir reidak.,There are many lorikeets.
Pasa me keirun tok kangguar.,The top of the rice is still undercooked.
"Keit, keit, keit, suagi kibisko laur.","Go landwards, landwards, landwards, tuna are moving at the landside."
Kai me keit owatko.,There is firewood up there.
Keitar me kalis ur.,The day before yesterday it rained.
An se sor met disara keitko.,I put the fish up there.
Tumtum sara rorkeitko.,The kids climbed to the top of the tree.
An keitpisia min.,I sleep with my face up (i.e. on my back).
Ma keleng nenenun mambon.,He has hair in his armpit.
Kelkam elauna patin.,The earlobe is wounded.
Aya Tok me pi mat gerkeret me kelkamun toktok.,"Aya Tok, if we as him, he's deaf."
Alif me kelkam posun ning.,Alif has earache.
An keluan ma toni sor saerak.,I heard him say there is no fish.
Keluer warkin kararakte ma gare.,If it's low tide the crab crawls.
Kemana me kapubaten giarten.,Kaimana is a new regency.
Kemanurpak me pi Pakpaka boet me ureren.,If we go to Fakfak in west wind season there are big waves.
Rustam taraun toni kadenun kememe.,Rustam's grandmother said she has a weak body.
Kerar me leng wilaun me reidak.,There are many turtles infront of the village.
"Yuon sarara, kerkap.","The sun comes up, it's red."
Kerker aremun kon Masko.,There is a big kerker tree at Mas.
Lampur kewe ma me leng kerunggo.,The electricity building is above the village.
Safril esun me - an mat gongunget me ketan.,Safril's father - I call him parent in law.
Dela mu Pakpakara ketelesjie.,Dela and family bought maize from Fakfak.
Wise me mu kewara sabur.,"Before, they wore loin cloths."
Kewe me he rouk.,The house has collapsed.
Mu bo kewe padenwuorma reba.,They go cut house posts.
Ki tamanggara bot?,Where are you going?
Desili koyet an koi panggutki tenaunat tawara.,"After planing, I use the panggut to chop the keel."
Kiaran se luk.,My wife has come.
Ka kiar kolakara era?,Did your wife go up the mountain?
An sanggara ba kibi saerak.,I looked but there were no sea cucumbers.
Kibibal saerak.,There are no weight watchers.
Kibis me yar.,At the mainland there are stones.
"Go lalang, pi kieun elaunggo melelu ur jiejie.","It's hot, we go look for wind in the shade."
Alun mu kielmarok teba.,Alun and his friends are catching prawns.
Kiem ma me se ten.,That basket is old.
An Buranat kiempanait pitisat.,I send money to Burhan.
Kier tamanggara botkin?,Where are you two going?
Wat arkon ma me kier metko.,In that coconut there is a wasp.
Abdula esun mu etkies teba.,Abdula's father and family are carving a canoe.
Nina kacang gorengkies teba.,Grandmother is packaging fried peanuts.
Ramina emun pasa baranggapkies.,Ramina's mother is wrapping yellow rice.
Wer me kies koladok me reidak.,At Wer there are many Colocassia's.
Bal kiet me Kiaba me reidak.,There is a lot of dog poop at Kiaba.
Som yumene me kietpaun ning.,That person has an ill large intestine.
Ma kietpoun gawarunǃ,His fart stinks!
Dela esun se koi kion. Kieun caun Tuti emun.,Dela's father married again. His second wife is Tuti's mother.
Kilibobang me Masko reidak.,There are many butterflyfish at Mas.
Wat kin reidak.,We have many coconuts.
In muap Tami mukin keweo.,We eat at Tami's.
Et sabarkin.,The front of the canoe.
An kona ma rouin deba.,I think he is falling over.
Wiseme Ayah Ludin esun kinggir Kamburga bara.,"Before, Ayah Ludin's father sailed to Kambur."
Sakina emun yongsongat bisa kinkin.,Sakina's mother can sail a motor boat.
Bobi emun kokoun reidak ba tok kinkinun.,"Bobi's mother has many chickens, but they are still small."
Kinkinun opa me he sararet.,That small one already went up.
Kip Unyil kokounat kokarap.,A snake circles Unyil's chicken.
An sor sira ba kipkip reidak.,I am salting fish but there are many larvae.
Om Nostal me kir.,Uncle Nostal is greedy.
Davit emun watkir.,Davit's mother is grating coconut.
Bal yumene kirkangkangunsaet.,That dog is all skin and bones.
Binkur esun kirun ning.,Binkur's father's flank hurts.
"Kisileng se bo barsi, eba welenggap.","The sky is brightening, then it will be blue."
Mier waranggeit koar teba.,They two are diving for red cluster whip.
Ma Tanggorko.,He was at Tanggor.
Sikan ma me pang met kobelen.,The cat licked that pan.
"Abdula emun mu borara, in epka, muat kobes.","Abdula's mother and family went in the front, we in the back, (but) we reached them."
"Rifai emun me tumunun kodak, Rifai mautak.","Rifai's mother has only one child, Rifai alone."
Inier Bakri emunbon muapta an koi kodertaet.,"Me and Bakri's mother were eating, I added again."
Mei Bakri esunat kodi.,Mei called Bakri's father.
Tumun yumene don penpenara keecuan.,That child is crying for candy.
Mena tagurpaet me koep se bo lele.,When it's east wind season the ashes fly off.
Tumtum Sakina mu pasaromunat parua mu muat koewat.,"The childen are picking Sakina's family's ambarella's, they are angry at them."
Bobi emunbon Kiba emunbon mu melalu kofirna.,Bobi's mother and Kiba's mother sit drinking coffee.
An kier yuara kokiem.,I'm running away from this wasp.
Unyil esun korun neingda kaiat kokis.,"Unyil's father's foot is hurt, he wraped it."
Kalis urta pi lenggonat komera kokir.,When it rains we can see the other island close-by.
Kokoak kapuk pusunara na.,The helmeted friarbird eats from the kapok flower.
Rustam mu kokok iriskapten me reidak.,Rustam and his family have many white chickens.
Sara me kokok narun sanggare kai waruotkin.,Sara is looking for a chicken egg to make medicine.
"Alun esun mu wat parinunat yapta, tok kokour.","Alun's father and family are dividing the coconut revenue, but it's not enough."
Tuti mu bo keleka ra sayangsara.,Tuti and family go to the mountain to harvest nutmeg.
Nadia esun mu bo kolak owatkoa etkies.,Nadia's father and family go to the mainland overther to cut a canoe.
Rumasakitka mu kolambuat yap.,They hand out mosquito nets from the hospital.
Ma me sontum kolet.,He is a stranger.
Ma sontum kolgara luk.,She came from outside.
Davit emun me kolkiemun ning.,Davit's mother's thigh hurts.
Bilal esun et me di kolko.,Bilal's father is putting his canoe out.
Bobi emun bo warta nikaun kolkol.,"Bobi's mother went fishing, her fishing line was entangled."
Mama leba bo linggisrepte minggi paku koloin.,Uncle imam went to get a tool to pull out nails with.
Nabil emun inier melalu ba ma namanghadawi kolpis.,Me and Nabil's mother sat chatting but she was facing another place.
Jikri mu bo warta koltenteng etkoni ramie.,Jikri and his friends went fishing and caught one koltengteng fish.
Tami esun bo warta doromat koni koluk.,Tami's father went fishing and found a barrel.
Unyil mu didirasun balakangun me kom mambon.,At Unyil's family's back of the kitchen there is sugarcane.
"Camat mu lukta, in arep neko komahal.","Camat and family came, we in the bay didn't know."
In bo robaherkiemda Irjan esun kamelat etkoni komain.,"We went to bathe for robaher holiday, Irjan's father stabbed a stingray."
Kecaun dan lalangun komain.,Its kecap and its spicyness are just right.
Kalamang kokoat kinkinda ma koi komamun.,"Kalamang is holding a chicken, then he slips it."
Banda me komangun ning.,Banda has a sore throat.
Nyong emun mu tok keweunat komanggangguop.,Nyong's mother and family are closing the roof of their house.
Binkur esun komanggasirun ning.,Binkur's father neckbone hurts.
Esnem desa mu amdirunat komaruk arepneko.,The village head's family are burning their garden inside the bay.
Rustam taraun mu tong sangganunat komasasuk.,Rustam's grandmother and family closed the lid of the barrel.
"In melalu garungda, Bobi emun salai garungda, in mat komayeki.","We sat chatting, Bobi's mother said something wrong, we laughed at her."
Canam tumununat komet.,The man looks at his child.
Motor kon lukta Onin emun bo komet.,"A motor boat is coming, Onin's mother goes to look."
Lampur belek met komelekte!,Go burn that lamp in a can!
Nina Im taraun me kumiriun arkon Nina Tanggiunggo.,Im' s grandmother has one candlenut at Nina Tanggiun.
An kiat misternin.,I don't have problems with them.
Mustafa esun amdirun Kamberarkadok me komkomur reidak.,Mustafa's father's garden at Kamberar has a lot of cucumbers.
Salima esun mu fiberun kon.,Salima's father's family has one fibre boat.
Luasun me mungkin meter apkon.,Its width is maybe five metres.
"Fiber eira metko, kon tama Dian taraunkin? Kon kerkapten.","There are two fibre boats there, which one is Dian's grandfather's? The red one."
An kona in baratnin.,I think we don't come down.
Kiba esun kona motor kon metko war.,Kiba's father sees a motor boat fishing there.
An weleanat mukonggo nawaruon.,I forgot my vegetables at their place.
Faris korun patinda kaiat metko konawol.,"Faris hurt his foot, he stuck medicine onto it."
Fatima emun sominda ma mat konenen.,"Fatima's mother died, she remembers her."
An weleat maonggara jie.,A got vegetables from her place.
Ikoni an se parair mungkin etpurirkonggap ye.,"Some I chop up, maybe twenty pieces or so."
Dian emun Binkur esunat pergi konggareor.,Dian's mother went to pour water on Binkur's father.
Lusi etkon bara sorat konggelem.,An eagle came down and caught a fish.
Mu tok osie Usinona taraun mukonggo.,They rested at Usinona's grandparent's.
Irjan esun bo masura ma konyak etkoni komain.,"Irjan's father went night-fishing, he stabbed one squid."
Nabil gula-gula karerat nara ma ladanunggo kopol.,Nabil ate a chewing gum and stuck it to his shirt.
Korcara ning.,Your leg hurts.
Yasin esun me Bakri emun me korapmur.,Yasin's father and Bakir's mother are cross-cousins.
Urkia me korel patin.,Urkia's footsole is wounded.
Onin emun korgi marmar teba.,Onin's mother is walking.
Kor kancing wa me an tur teba ma patin.,"My ankle bone, I fell and wounded it."
Sila sandal emununat korko.,Sila is wearing her mother's sandals.
Unyil esun me korlausun temun.,Unyil's father has big feet.
Davit emun me kormulun temun.,Davit's mother has big calves.
Kornambi etkon yar keitko melalu.,A sheerwater sits on the stone.
Randa emun sorpotma eba korotrot.,Randa's mother is cutting fish and then makes notches.
Kiba emun korpak neinden ma botnin.,"Kiba's mother's knee hurts, she doesn't go."
Abdula emun korparokparok ning.,Abdula's mothers toes hurt.
Nyong esun kor tanggalip dukta patin.,Nyong's father hit and wounded his toenail.
Dian esun wiat kortaptap.,Dian's father is cutting the stem of the mango.
Suci esun korusun ba patin.,Suci's father's shin is wounded.
An sayang met kawayara ma he kos.,"I planted that nutmeg, it's already growing."
Mayor ror erun met Salima esun fiberunggi kosalir minggi Pakpaka botkin.,"Mayor exchanged his wooden canoe with Salima's father's fibre canoe, he wants to go with that to Fakfak."
"Unyil marmarta emunat kosara, emun tur.",Unyil walked into her mother and her mother fell.
Tumtum melalu sayang kosarun jie reba Pak guru Samkin.,The kids sit peeling teacher Sam's mace.
Pak guru Banda bo sayangkoser teba.,Teacher Banda is going harvesting nutmeg.
In Pakpaka bora in keweat koser.,"We go to Fakfak, we're locking the house."
An ter wat kosiauri ma.,I give him this water.
Tamandi esun mu bo erat kosiauri maruan.,Tamandi's father and family go push the canoe in the sea.
Nabil emun anbon garung ba ma anat kosilep.,Nabil's mother is talking to me but she's turning her back to me.
Binkur esun melalu tabaikosom deba.,Binkur's father sits smoking.
Dian taraun sorkotamde di sara sair.,Dian's grandmother skewers fish and bakes it.
Randa emun sikanat kotarakmang.,Randa's mother startled a cat.
Nabil esun bo wari wari ba kotipol.,Nabil's father went fishing for a long time but didn't catch anything.
Bakri emun mu dodon kotur reidak.,Bakri's mother's family have a lot of laundry.
"Suci emun dinkou, dinun nalatkin.","Suci's mother blows the fire, her fire is about to die out."
Tomi kieunbon Yasin emunbon naulelukta mier naukoup.,Tomi's wife and Yasin's mother meet each other and they hug each other.
Rukmana emun Rukmanat kout.,Rukmana's mother curses Rukmana.
Kowam etkon me sor bir sarara ma nerunggo nauraurar.,A whale is circling bir fish that are jumping.
Tomi emun melalu kiemara kowam.,Tomi's mother sits weaving a basket.
Nina Ruslan taraun sor sairta ma dinat kowaram up.,"Grandmother Ruslan's grandmother bakes fish, she clamps (embers) to kindle the fire."
In kanggaranat kowararan paror kerunggo.,We are making a bamboo floor on the raised platform.
Salima emun Salima ladanunat koni jie ba kowewepkon.,Salima's mother bought Salima a brown shirt.
Nina Ruslan taraun mu keteles kowaya amdirunggo.,Granny Ruslan's grandmother and family planted maize in their garden.
Desi melalu ba Fit mat koyalsawe.,Desi sits but Fit is disturbing her too much.
Dalima muawat di sara meja kerunggo koyen.,Dalima puts the food on the table and covers it.
In pasaun se koyet.,Our rice is finished.
Alun esun watkoyos teba.,Alun's father is climbing a coconut.
Salima pasakuar teba.,Salima is cooking rice.
Nina Ruslan taraun tok kuat.,Granny Ruslan's grandmother is still strong.
Opa saun kuawi bot.,Yesterday night the north wind blew.
Wa me mama tua Ludin emun kubirun.,This is aunt Ludin's mother's grave.
Tat me kubirar reidak.,At Tat there are many graves.
Moktar esun Kueimang deba.,Moktar's father is speaking Kilimala language.
Binkur esun hapeanat casta sontum se kuek.,Binkur's father was charching is phone and people stole it.
Kuk etkon yumetko melalu.,A fruit-dove sits there.
Kul arepneko me he lalat.,The weeping fig in the bay is dead.
Kul epkon me lamut etkorenat na.,A school of kul fish is eating canoe algae.
Ibu guru Ratna namangonda kulikuli kon.,When teacher Ratna married there was one gong.
Kulkabok arkon Kambur oskolko.,There is a kulkabok tree at the edge of Kambur beach.
Sakina bo jambatanggara wienmukta kulpanggat ramie erir.,Sakino went to throw fishing line from the dock and caught two kulpanggat fish.
"In me sayangun reidak kumkum, ge.","We have many male nutmeg trees, don't we."
Muklis emun me pasun goni kon me kupkuwun reidak.,Muklis' mother have sack of rice with many husks.
Abdula esun mu Gowiengga marua kurap kanggeit.,"Abdula's father cambe back from Gowien, a dolphine played."
Arifin kona kurera etkon garegare.,Arifin saw an octopus crawling.
Bakri emun muapsabur kurera reba minggi sanggeran paruotkin.,"Bakri's mother is sieving sago, she wants to make sago."
Ma he mara adiunat kuru marua.,"He went to land, and brought his brother back (seawards)."
Kurua kona yarkeitko mambara sorara jaga.,An ibis is watching fish standing on a stone.
Rukmana mu kus koyal teba.,Rukmana's family are mixing charcoal.
Nonabon Alunbon hukat paruakta labis reidak.,Nona and Alun are throwing fishing line and (caught) many labis fish.
Siti Kelsaba emun mu Tamisengga sara ladanparin.,Siti Kelsaba's mother and family came from Antalisa to sell clothing.
Lajarang watkoet saerak.,There are no horses here.
Rajiba tarauna kadenun lalang.,Rajiba's grandfather has a fever.
Lamora kasamin erir pararuoni owangga bot.,Two cormorants flew over there.
Go girgirta me lampur se yuol.,In the late afternoon the lamps already burn.
An pasieko waruo eba an lamutyuon.,I bathed in the sea and then I scrubbed my skin.
Abdula esun bo langgan potma ba erunat ramietkin.,"Abdula's father goes to cut pieces of wood, then he wants to pull his canoe."
Bilal esun erat mengga ramieni maratkin ba go langgour.,Bilal's father wants to pull the canoe up the shore but the spot is too tight.
Tumtum langka reba.,The kids are fighting.
Sor wa me he lauk.,This fish smells.
Ma marmar bo lengungga lauk.,She walked until her village appeared.
Rifai emun wa ba lauk.,Rifai's mother appears here.
Tami emun perlalangkuar teba ma he laur.,"Tami's mother was boiling hot water, it boiled."
"Ka talalu laursawe, owangga boreǃ","You are to noisy, go over there!"
Jawawas yumene kanggirarun lauskaning bolon.,That Javanese woman has a slightly wide face.
Alun mu sarimat lawalawat.,Alun and his friends are putting guavas in a pouch.
Manado lawanramie reidak.,Manado caught many groupers.
Janiba emun me lawarun me bes.,Janiba's mother's womb has healed.
"Kalkalet anat koraruora, layierta an kaware.","A mosquito bit me, it itched and I scratched."
Leba Pakpaka bot.,The imam went to Fakfak.
Onin esun sayangara lebaleba.,Onin's father is carryin nutmegs.
Faldi bo sayang tangreitkoni bo parin ba lebe tanggaruok.,Faldi went to sell one hundred nutmegs but he had three too many.
Ma rorat lebe.,He's higher than the tree.
Leit pas me sontum Patipi.,The queen is from Patipi.
Lek kandungunat Maskoa paruo.,They are making a goat pen at Mas.
Salima emun kadounat masara ma lele.,Salima's mother was drying her sarong and it flew off.
Dian esun mu distrika bora mu muat lem.,"Dian's father's family go to the mainland, they ordered with them."
Wiseme mu lemara napakire minggi etkies.,Before they used a big-bladed axe to carve canoes.
An lemat jiere sanong gaimkin reba.,I'm getting bamboo string to sew a roof.
Lempuang leng newuaunggo.,The island in front of the village.
An tok lemyar met konatnin.,I haven't seen that stone axe yet.
Leng Kiaba me bal reidak.,In Kiaba there are many dogs.
Leng dekta an narasa.,"There was an earthquake, I felt it."
Mama Jawa Tuti lenggalengga sanggara ba saerak.,Mother Tuti Java is searching for chill but there isn't any.
Rajiba esun mu bo Lenggongga sayangsara.,Rajiba's father and family go to Karas Darat to harvest nutmeg.
Rajiba esun mu bo Lenglengga war.,Rajiba's father and family go fish at Lengleng.
Faisal emun bo warkin ba lepalepa saerak.,Faisal's mother wants to go fishing but there is no wooden canoe.
Nyong esun serie mama Nadia esuna lepir parair.,Nyong's father sends uncle Nadia's father split rafters.
Sontum taruo toni lerang Buruoa mambon.,People say there is white gum at Buru-buru.
"An erat catkin. Kit welenggap, lesun baranggap.","I want to paint the canoe. The top white, the stem yellow."
Kalis ourten me uriap licing.,"It's raining, so the street is slippery."
Pat emun limpotma reba.,Pat's mother cut the umbilical cord.
Randa emun litiat jie.,Randa's mother bought a bracelet.
"Nabil esun fiberunat Nabil taraun mu paningda, ma lo.","Nabil's father asks for the fibre boat from Nabil's grandfather's, he consents."
Binkur esun go dungga karajangi mindi bo lohar.,Binkur's father worked from the morning until midday.
Aprilia maun toni mu he loi boet.,Aprilia's wish is that they go quickly.
"Kewe mul inggon me lolok reidak, afokat olun.","There are many leaves at the side of our house, avocado leaves."
"Unyil loloukruo reba, warumara dankin.",Unyil is digging a hole to bury trash.
Mustafa esun loncing me gosomin.,Mustafa's father's watch has disappeared.
Nina Ruslan taraun lopalopat paruo reba.,Granny Ruslan's grandmother is making a woven envelope.
Tomi emun wienmukta loptengat ramie reba.,Tomi's mother was throwing fishing line and caught a shark.
Pi los kerungga gapurat komet me rasa.,We like to look at the welcome gate from the dock.
Tamandi esun Binkur esunkongga lorat paning.,Tamandi's father asked for sinkers from Binkur's father.
Kamberar me loup arkon metko urapko.,There is a loup tree at the path in Kamberar.
Minuman wa me lu.,This drink is cold.
Tagurep me pasier luam.,On the east side the water is murky.
Safarudin mu Sorongga luk.,Safarudin and family came from Sorong.
Lusi etkon bara sorat jie.,An eagle cam down to catch a fish.
Lusi muaun me Sarko reidak ma ma he sasa.,"There are many lusi muaun trees at Sar, but they are dry."
Ma tamanggara bot?,Where is he going?
An kat nani maoyet.,I'll eat you whole.
"Tumtum eir narasta. Emun toni: ""Ma he me, kimun se narasin.""","Two children fight. Their mother says: ""That's it, don't you fight anymore."""
Maryam ma temun.,Maryam is the firstborn.
