Kalamang_Sentence,English_Translation
Mu sontum putirie bo rapat.,They eighty went to meet.
Ror ma me tebonggan putkaninggonie.,That wood all together is ninety pieces.
Sayang bungaun tagierun tebonggan putkaninggonie talinkaninggonie.,The weight of all the mace is ninety-nine.
Pitis ma me ripi putkansuor.,That is forty thousand rupiah.
Sor me et putkansuortalinggon.,That are forty-one fish.
Desi pitisun ripi putkaruok.,Desi has thirty thousand rupiah.
Ema desa buok paningda an tang putkaruoktalinggaruok ma.,"The village head's wife asks for betel, I give her thirty-three seeds."
Ror me reidaun putkaruoktalinggon.,The amount of wood is thirty-one pieces.
Kai yume putkaruok talinir.,That firewood is thirty-two pieces.
Alun ladanun kies putkon.,Alun has ten pieces of clothing.
Faldi sepatun nomorun putkonbakaruok.,Faldi wears shoes size thirteen.
Kokok nar ma me putkonbakon.,Those chicken eggs are eleven.
Polkayak ma me tebonggan putraman.,Those papaya's are sixty in total.
Nabil mutilun reidaun tebonggan putramandalin.,Nabil has seventy marbles in total.
Ki bo ra ba wuormar!,You go cut [it] down!
An yonsong nunat ra.,I hear the noise of the boat motor.
Dian emun owangga ra.,Dian's mother comes from there.
Tamandi emun me rak dodonun temun.,Tamandi's mother has a big clothes shelf.
Ram wilao yuame se korek.,The coral reef in this sea is dead.
Ram kolkemkem me tebolko.,There is kolkemkem coral at the reef edge.
Wie me nak raman.,There are six manggoes.
Mu naukiaka reon me mu ramandalin.,They are maybe seven siblings.
Bakri esun ma sor ramie reidak.,Bakri's father caught a lot of fish.
Sor tiri ran mian.,The fish swims back and forth.
Rang yuame pasier up.,This open sea is quiet.
Mu raor yumetkoa war.,They fish in the middle there.
Nyong emun mu garungda mu rap.,"Nyong's mother and friends are chatting, they laugh."
Nema namun me sontum Rarait.,Nema's husband is a Seramese.
Nina kalifanat paruotkinda ma tok rarie.,"Grandmother wants to make a mat, she softens the pandanus stirps first."
Lenggalengga ma me reidak.,There is much chilli.
Ka manadu met mara talalu reidaksawe.,You gave him too much taro.
Ma sorat kara reingge.,He didn't give you much fish.
Onin esun pokpounat parinda ripi reirap.,Onin's father sold his small motor for 500.000.
Mayor kieun ladanat ka reon?,Maybe Mayor's wife gave you a shirt?
In Kindiuska bora an rerat arkoni wuorma.,"We go to Kindius, I want to cut a rer tree."
Wowa Ruslan me mu rerer teba.,Aunt Ruslan and friends are chatting.
Sasep temun kona warip ye.,"A squirrelfish this big, maybe."
Kukia me me ripionde kon.,Those cookies cost one thousand per piece.
Wat ime ririn.,That coconut is tall.
Mena hari robaet eba Dela esun mu Pakpaka boet.,When it's Wednesday Dela's father and family go to Fakfak.
Ror garta me watko saerak.,There are no rubber trees here.
Ror iriskap me Wapkoa mambon.,For gum tree/eucalyptus you have to go to Sanggalabai to find it.
Ror tabur met ka tok potmatnin?,"That tree stump, didn't you cut it yet?"
Ror karok me he sa.,That tree branch is dried out.
Tanisa ma me se rouk.,The tanisa tree has fallen over.
Dian esun tiri bo owanggata koi roye.,Dian's father runs over there then turns around again.
Hairul lampurat ruan.,Hairul turned of the lights.
Malik ruarat etkoni ramie.,Malik caught a shark.
Ruar bodaren etkon metko nalat.,There is a dead tawny nurse shark over there.
Ruar kanggir nungnung me pi kurang kona.,We seldom see the tawny nurse shark.
Bobi emun rumramie reidak.,Bobi's mother caught many rum fish.
Mama Putih me namun Rumbatica.,Mama Putih's husband is from Onin.
Rumrum Kambur oskeit me bo rasa.,The rumrum plant at Kambur beach is very good.
Abdulah emun panggala ruo reba.,Abdulah's mother is digging cassava.
Ka pasat kuarta he ruon.,"You cook rice, it's already done."
Ruom yawene tumtum kanggeit.,At the foothill down there the kids play.
Abdulah esun me ruop sore erunara pawankin.,Abdulah's father is cutting plugs; he wants to put planks on his canoe.
"Suo me rur kurang me, ar konkodak.","At Suo there aren't many casuarina's, just a few."
Onin esun me hukat paruakta sor rurkon.,Onin's father fished with a net an caught one skewer of fish.
Riski emun mu sayangun arkon sa.,Riski's mother's family have one dry nutmeg tree.
Mayor saban potma minggi tal kanietkin..,Mayor is cutting saban bamboo; he wants to make a fence with it.
Pak guru Elisa me Sabaorca kon.,Teacher Elisa is a Buruwai.
Et sabar me he durcie.,The front of the boat is leaking.
Nyong emun mu keweun me sabarak napaki.,Nyong's mother's family's house has space under it.
Mayor me koi sabelunara masir.,Mayor is weeding is cleared spot in the forest.
Ramli kieun sabet mat paruo.,Ramli's wife is suffering from a boil.
Alun esun sungsung kahen sabur teba.,Alun's father is wearing long trousers.
Mustafa emun mu nasuena saerak.,Mustafa's mother's family don't have sugar.
Wat ma me muinsaet.,Those coconuts are all theirs.
"Saier, kamun nein me ka asokmang.","That's bad luck, don't eat or you'll be short of breath!"
Saimbumbu me jaranget eba pi konanet.,We seldom see a dragonfish.
Usmanbon Kadirbon bo sairarar kowar.,Usman and Kadir go lobster diving.
Wowa Kambur emun panggala kawayatkin ba sakarip saerak.,Aunt Kambur's mother wants to plant cassava but she doesn't have a dibble stick.
Laka mu keweunat Tatko paruo ba salat dira.,Laka and family are making their house at Tat and they are putting up the roof wood.
Fitri ma me sala.,Fitri is wrong.
Ka eware sala.,You talk wrongly.
Mama leba et sabarun salaboung.,Uncle imam's front of his canoe is broken
Sayang salaon.,Ten thousand nutmegs.
Salawei Tanggor me mambon weinun.,At Tanggor there are cone shells too.
Kiem met salirte.,Move that basket.
Samameng warat daruore bo reidak.,The civet cat pierced many coconuts.
Nazua me ranti samorara napaki.,Nazua is wearing a chain with beads.
Ladan wa me samsik.,This shirt is thin.
Samuret sontum ma luk.,A Mbaham person is coming.
Ona dunun me sanam mat paruo.,Ona's sibling is suffering from smallpox.
Sanggan ma me wat met na ma durma.,The beetle is piecing that coconut.
Embir me sangganun se gosomin.,That bucket's lid has disappeared.
Alun esun bo Alunat sanggaran.,Alun's father goes to look for Alun.
Usman lepalepa yonsungunat sanggat kokanie.,Usman is tying an outrigger to his motor canoe.
Pawan posun met Irjan esun se sanggie.,Irjan's father already closed that hole in the plank.
Sanggien me warkin emun me ma ewaet me besun.,If the tide is very low you can hear the cenderawasih very well.
Moktar sanggoup potma reba.,Moktar is cutting branches.
Suar karuok kon sanggoyien.,An iron wood branch broke off.
Kewe sanong me he pururu.,The leaf roof is destroyed.
Mei bo warta sanualat ramiera bo reidak.,Mei went fishing and caught many humpback snappers.
Sundus ma saor inggonara napaki.,Sundus is using our anchor.
Kerar kona yawengga saouk.,A turtle emerges down there.
Om Ipin mua Tamisengga sara.,Uncle Ipin and family come up from Antalisa.
Inininggan bo sayangsara.,We all go to harvest nutmeg.
Alifa kortas me paruo sarakmang.,Alifa makes the paper rustle.
Kalis mununara sarangburung na.,It's rain bugs that swallows eat.
Saraminan Burhan se bo paruak.,Burhan went to throw away my glasses.
Saranggeit me epka wa me saerak.,"Lately, there are no saranggeit sea cucumpers here."
Rajiba emuna saraunun kon.,Rajiba's mother has one rice field hat.
Bakri esun mu bo sarbal war teba.,Bakri's father and friends are fishing for groupers.
Go dung Dian esun mu Pakpaka botkin ba et saren.,"In the morning Dian's father's family want to go to Fakfak, but the canoe is stranded."
Ibu guru emuna sarem mambon reidak.,The teacher's mother has a lot of ginger.
Faris esun mat sirie ba ma jabul esun mat sarie.,Faris' fater chases him but he's tired of is father chasing him.
Tarus me eba sarieng mambon.,First when you arrive at Tarus there are cliffs.
Tat me sarik arkon metko ba ma he lalat.,There is a cockspur coral tree at Tat but it's dead.
Mas me sarim teun reidak.,There are many guavas in Mas.
Mas sarit tumun me sor na.,At the small shoal at Mas the fish feed.
Panggala me se koi saroumsaroumdaet.,The cassava is already shooting again.
Unyil esun ma kumisunat sarua. Irul ma potlorunat saruan.,Irul sharpens his pencil.
Bakri emun sarun ma mambon.,Bakri's mother has a rice sieve.
Ma kairep teba ba sasat ma he ecien.,He was getting firewood but quickly he returned.
Supri ma loska wienmukta ma koi sasep ramie reba.,Supri was fishing from the dock; then she was catching squirrelfish.
Mei ma erunat ma saser kanie reba.,Mei is tying the outrigger of his canoe.
Tami esun mu bo sasirip potma minggi sayang karuar.,Tami's father and family went to gut sasirip bamboo; they want to make a nutmeg drying rack with it.
Suci emun sasul panok Bilal emunbon.,Suci's mother orders a spoon with Bilal's mother.
Opa saun me kalis baranin.,Last night it didn't rain.
Unyil emun mu nontonet me se bo saun lat.,Unyil's mother and family watch tv until late at night.
Mena tolaset me tumtum saurat gonggunget me se parar.,"When it's ramadan month, when the children call the Zuhr prayer we get up."
Lampur lalara leng se bo sausaun.,"There is a power cut, the village is dark."
An barara go sausaunda an sawaluowaluoi bara.,When I go down when it's dark I go down feeling around.
Sawarer wilak yua me reidak.,There are many tortoises in the sea here.
Sayang se sawaun.,The nutmegs are ripe.
Sawawien me Namandar me mambon.,At Namandar there is sawawien string.
Gustami me pi mat siriret me ma jabulsawe.,"Gustami, if we order him to do something he's lazy."
Sayang arun me kalista ma bo palawak.,If it rains the nutmeg tree is slippery.
Sayang bungaun parinun wanggon wa me rasa.,The mace price like this is good.
Sayang tangunan parinun bes.,The nutmeg seed has a good price.
Sudir mu seat etkoni jiera mu pasaromggo kanie.,Sudir and friends got a cuscus; they tied it to the ambarella.
Binkur esun mu bat paruo ba se koyet.,Binkur's father and friends were making a container but they're finished.
Sebua etkon marua Rustam kokounat na.,A lizard went seawards and ate Rustam's chicken.
Sebuaror me pi potmaret me sebua piat pareir.,"If we cut sebuaror, the lizard follows us."
Sadawak me parinun puraman?,"The machethe, how much does it cost?"
Ardi esun ma bo sairkoa sek.,Ardi's father goes fishing at the fish feeding spot.
Yanti me se sekolanin.,Yanti doesn't go to school.
Bo ladan seletkonja koni saburte.,Go wear that piece of clothing!
Unyil tumunun anat sem.,Unyil's child is afraid of me.
Sembamsembam me los mul me mambon.,There are damselfish next to the dock.
Tumtum Tatko kanggeire mu gol sempang.,The kids are playing football at Tat.
Randa emun me ma semsuk.,Randa's mother is caught with fear.
Kieun yie wasen.,His wife was swimming (in the water) up until here.
An sayangat di serneko.,I put the nutmegs in the attic.
An sayangat sergi koser.,I'm harvesting nutmegs with a hook.
Mu bo ar ba sere reidak.,They went diving but there were many itchy fish.
Bakri taraun sirie Kiba esun sereat di suolunggo yuon.,Bakri's grandfather ordered Kiba's father to rub nettles on his back.
Faldi mu bo sor karopta sere kokokteng mat sie.,Faldi and friends went to shoot fish and a sea fern stung him.
Burhan mu bo sere taraun kowarte mu keitkin.,Burhan and friends went to dive for anemone fish to keep.
Irul emun manadu seser.,Irul's mother is peeling taros.
Rifai emun bo warta seser ramie bo reidak.,Rifai's mother went fishing and caught many bridled monocle breams.
Seser serein Bobi emunat sie.,An itchy sea creature stung Bobi's mother.
Tami esun bo set sanggara reba.,Tami's father went to search for bait.
Lamani esun kaipotmara wewar seurte kurunat kosara.,Lamani's father was cutting firewood and the axe bounced off and hit his leg.
Leng wa me inun me Sewa.,This village is called Sewa.
Satawia esun bo warta koi siabora ramie.,Satawia's father went fishing and caught a signal goby.
"Ur se bore siamarun, irisaet.","The wind blows terribly, the wave crests are white."
Sere anat sie. Tomi ma sedawaksie reba.,Tomi is sharpening a machete.
Tumtum yume kanggeiret me siepsieun.,Those kids play at the very edge.
Bayu esun ma karek sieunat potma.,Bayu's father cuts the edge of the rope.
"Nabil emun ma marur mat paruora, ma sik.","Nabil's mother is bothered by mucus, she sneezes."
Sikan soranat nara an komahal.,"A cat ate my fish, I didn't know."
Yol taman me Tiworat usiep me kibi sikasika me reidak.,At a certain time at Tiworat shoal there were many leopard sea cucumbers.
Sikekan kona oskeitko marmar.,A seagull walks on the beach.
Sil me nasiwet eba pi koluet.,Only by fortune we find volute shells.
Ana borara ma me silepko.,I'm in the front the's in the back.
Aina emun mu sililar repte minggi kalifan paruotkin.,Aina's mother and family went to get sililar pandanus; they want to make a mat with it.
Salima emun don patkin ba sin saerak.,Salima's mother wants to sew clothing but there is no needle.
Singasingat Unyil mu keweun me reidak.,At Unyil's house there are many ants.
Go he sir.,The sky has cleared up.
Bobi emun sorsira reba.,Bobi's mother is salting fish.
Tami emun ma sirarai paruo reba.,Tami's mother is making a twig broom.
An me siriaran me se kawarcie.,My oven has cracked.
Rukmana emun ma Rukmanat sirie bo pulor jie.,Rukmana's mother ordered Rukmana to buy betel leaf.
Sisiapong Madi emunat sie.,A lionfish stung Madi's mother.
An bestalanat sisirkin ba sisiran saerak.,I want to comb my hair but I don't have a comb.
Salima esun ror buabuara so.,Salima's father is peeling round wood.
Sobasta ma he Pakpaka bot.,He went to Fakfak at dawn.
Binkur esun kareat kaniera se bo sok.,Binkur's father tied rope until it was tangled.
Hawa tumunun cicaun me ma soksok.,Hawa's small child has the hiccups.
Sol karek watko saerak.,There is no rattan here.
Tomi emun solim cigire natkin.,Tomi's mother caught a solim fish; she wants to eat it.
Som yume lukte nebara paruo?,That persone that came what is he doing?
"Yo, haidak someǃ","Yes, of course it's true!"
Pier se ecieret someǃ,"Come one, let's go already!"
Som kona Pourko somin.,A person in Faor died.
Sontum me mahap tamanggara bot?,"All those people, where are they going?"
Sontum yu me warten.,That person is a sorcerer.
Tol emun me sontum kabas.,Tol's mother is a stranger.
Mama Agus mu marua sopsop parin.,Mama Agus and family sell hair pins.
In sor saerak.,We don't have fish.
Sor kangunara Mustafa esun komaruk.,Fishbones is what Mustafa's father is burning.
Tami emun sor sira paruo reba.,Tami's mother is making salted fish.
Irul emun mu Sorungga bot.,Irul's mother and family went to Sorong.
An tok koranat meja keirunggo sosoet.,I stretch out my feet on the table.
Dian esun mu bo pawan masousou reba.,Dian's father and friends go sliding down planks.
Randa emun mu me souk reidak.,Randa's mother's family have a lot of mice.
Halim se sowilunat ma sarua.,Halim already shaved off his sideburns.
Irjan esun ma suagiat ramie reidak.,Irjan's father caught a lot of tuna.
Nyong emun mu panggala kirte minggi suamin paruotkin deba.,Nyong's mother and family are grating cassava; they want to make cassava snacks with that.
Me leng kerun me suarkang kon metko.,There is a hole above the village.
Kiba esun mu bo saritkara suban.,Kiba's father and friends go fishing from the shoal.
Pawan wa me suensik.,This plank is light.
Nabil emun toni ma ladan wat suka.,Nabil's mother said she liked this shirt.
"Selagur Wadan sukaun ge: ""Ka borarei!""","Selagur Wadan doesn't want: ""You go first!"""
Pawan wa me sumsik.,This plank is light.
Arlan taraun kiem sun deba.,Arlan's grandmother is tying the rope of basket.
Esnem desa bo sunak potmare di korunggoa kiskin.,The village head goes cutting sunak; he wants to wrap his foot.
Jafaris ma sungsungun kies kasuori jie.,Jafaris bought four pairs of trousers.
Faris mu suoktal karop teba.,Faris and friends are shooting suoktal.
An melalu dodon waruo suolan ning.,I sit washing clothes; my back hurts.
Ma suolkanguna ning.,His backbone hurts.
Suolkasir ana ning.,My spine hurts.
Jikri ma kerar komainda suolkerunara kosara.,Jikri stabbed a turtle and hit its back.
Suopkaling kona yarner imetko.,There is an eel inside that stone.
Ur se boren me pi boet susia.,"The wind blows hard, it's difficult to go."
Ayah Tok amdirat komarukta din susurte talat na.,Ayah Tok burned his garden and the fire burnt his fence.
Madi mu he bot?,Did Madi and family leave yet?
Tomanjara wa?,Is this your bag?
In Timi Nepnewi kaluarta me ur mendak.,"We exited from Temi Nepnep, the wind was like that."
Binkur esun mu taba potmare minggi bak paruotkin.,Binkur's father and friends are cutting iron; they want to make a container with that.
Tabai leng wa me saerak.,There is no tobacco in this village.
Ror ma me tabak puraman?,How many pieces of wood are that?
Supri emun ma jambatarga warta ma tabalamara koni ramie.,Supri's mother fished from the dock and caught one midnight snapper.
Bak inggon me per se tabaon.,In our container the water is already halfway.
Onin esun mubon Suci esunbon nautabarak.,Onin's father and Suci's father crashed into each other.
Bakri esun tabaruop napasang deba hukatko.,Bakri's father is putting sinkers on the fishing net.
Irul emun mu taberak wele paruo reba.,Irul's mother and family are cooking jackfruit leaf.
Aina emun mu bo tabul potma.,Aina's mother and family are going to cut tabul bamboo.
Madi emun mu bo tabuon kajie reba.,Madi's mother and family go picking small clams.
Talok mulun me tabuonsal mambon.,At the edge of Talol there are nerite shells.
Ror wa me tabusik.,This piece of wood is short.
Alun taraun esnem me ma tadon.,Alun's grandfather is coughing.
Irul mu bo kahamin sairta mu taerat koni kona.,Irul and friends went to shoot birds and they hit a tree kangaroo.
Pasierat mat kosarandaero bes.,Even if the sea water touches it it's okay.
"Didirasunat paruo koi sanong, sanong tok kokour koi bo sanongat reptaet.","Making the kitchen, then the roof, there's not enough leaves, we go fetch more roof-leaves."
Supri me mambara se bo tagarar.,Supri stands with her legs very wide.
Sayang goni kon wa me tagier.,This one bag of nutmegs is heavy.
Hasrun ma tagirat eriri ramie.,Hasrun caught two mackerels.
Tagur bora pi se sorat natnin.,The east wind is blowing; we won't be eating any fish.
Mena mosun taguret eba tagurewun luet.,When it's east wind season the torresian imperial pidgeon comes.
Mena tagurpak eba sontum kibiat paruoret.,When it's east wind season people will prepare sea cucumber.
Lepir taikibiskadoa pakure!,Nail the rafters on the inland side!
Nabil emun mu he bore jam taikon.,Nabil's mother and family left maybe half an hour ago.
Andain ladanan met ma.,It was me who gave that shirt of mine to her.
Pawan wa me tebonggan tak puraman?,"These planks, how many are they in total?"
Randa emun ma takurera parua minggi sor kuarkin.,Randa's mother is picking sour bilimbi; she wants to cook that with fish.
Mustafa esun ma tal kanie reba.,Mustafa's father is tying a fence.
Dalima mu talep yumetko.,Dalima and family are outside there.
putkansuor talinggon,fourty-one
Irjan esun sor kawaramat etkoni komainda ma taluk.,Irjan's father caught one triggerfish but it escaped.
Kon tamara ka jierun?,Which one did you get?
Lolok saeraet pi tamandia paruoret? Tamandi (nauwar bes)?,How are you (do you have good news)?
"Ki tamanggara yecie? Ge o, owangga.","Where are you coming back from? Oh, just from over there."
Mustafa esun tamatil parua reidak.,Mustafa's father plucked a lot of tomatoes.
Rajiba emun pasat di tamatko?,Where did Rajiba's mother put the rice?
Mu tamawis teba? Ge o mu owanggara bot.,"Where are they going? Oh, just over there."
Yahyah emun ma tanun ning.,Yahyah's mother has pain in her arm.
Tomi emun toni ma me tankasirun ning.,Tomi's mother said her wrist hurts.
Bakri esun yaralus kajie tan lausun neing.,Bakri's father collected small stones; his handpalm hurts.
Rustam taraun ma me tanbes.,Rustam's grandmother is righthanded.
Tanggal bara Sakina mu kokok tumununat koni kuet.,A bird of prey came down and stole one of Sakina's family's chicks.
Muklis esun et fiberun me tanggal.,Muklis' father's fibre boat brings good luck.
Desi tok tanggalip potmatnin.,Desi didn't cut her fingernails yet.
Tanggarara me Rajia emunkin.,That ring is Rajia's mother's.
Nona Marni nebara ka tanggo?,Nona Marni what are you carring?
War kasaret me tanggon mara palolanara na.,During the morning tide the boxfish comes landwards to eat algae.
Tanggor owa me se reida korek.,Many of the mangrove trees over there are dead.
Tanggulca neba kosara?,What did you hit your elbow on?
Namana se anggas tanggorman?,Who opened the door?
Sayang tangun me parinun rasa.,The nutmegs have a good price.
Bayu esun ma toni tanparoemunun patin.,Bayu's father said his thumb is wounded.
Binkur esun ma tan paroun patin.,Binkur's father's finger is wounded.
Ema tanggararat koni tanparok pendenggo napasanget.,Mother puts a ring on her ring finger.
Gani ma tanparok me raorkadok yar kosara.,Gani hit his middle finger on a rock.
Saleha me tan sahadarun rua.,Saleha has a swollen index finger.
Rustam me ma tan tayon.,Rustam is lefthanded.
Ona emun taokang komaruk teba.,Ona's mother is burning coconut shells.
Binkur esun ma Salima taraunkonggo taot paning.,Binkur's father asked Salima's grandfather for a chisel.
Suryan emun ma kanggirun popta ma bara taouk.,Suryan's mother was tired and she lay down.
Wise me Tarar me tapar reidak.,There used to be many kangaroos at Tarar.
Mustafa emun mu tapongat sak koni jie.,Mustafa's mother and family bought a bag of wheat flour.
Kiba esun nika tar teba.,Kiba's father is coiling rope.
Pawanat iskaptar!,Plane the planks!
Faldia anggasat tara.,Faldi closed the door.
"Moktar esun ma Dian taraunat gerketː ""Tara tamatko?""","Moktar's father asked Dian's grandfather: ""Where is your grandchild?"""
Tumtum nawarabirta Unyil tumunun tarakmang.,The kids are making noise; Unyil's child is startled.
Tarakues me Yahya mu amdirun me mambon.,There is tarakues string in Yahya's family's garden.
Karekca me taraman puraman?,"That string, how many fathom is it?"
Warkin se laurten me ma tarangini bot.,The tide is rising; the south wind blows.
Dian taraun bo warta ba kalingun se taraouk.,Dian's grandmother went fishing but her hook snapped.
Paden jambantarkin yawe me tarapa reidak.,At the dock poles there are many tarapa shells.
Unyil emun korun tararapangun neing.,Unyil's mother's heels hurt.
Onin emuna se mubon taruo.,Onin's mother already told them.
Tata kaina me.,That's your grandfather.
Perusahan eba tatkolak mambon.,First at the mainland there are Bomberai inlanders.
Tatanina kain me nebara paruo?,What is your grandmother doing?
An tok tataninanus anggonat konatnin.,I've never seen my greatgrandmother.
Tatanus muin se somin.,Their greatgrandfather is dead.
Tatapang euna kona owa.,A tatapang bird's is over there.
Mu taukona owangga bot.,Some went over there.
Nyong ma semenat sak koni bitkora se bo taungtaung.,Nyong is carrying a bag of cement (so heavy that) he is bent.
Wat taurkona owane.,A heap of coconuts over there.
Ainu mu wat tawara reba.,Ainu and family are chopping coconuts.
Tamandi emun dodon tawie reba.,Tamandi's mother is taking the clothes from where she was drying them.
Kortasara mu tawotman minggi pasa kis.,They fold paper; they want to wrap rice with it.
Mang me he tayuon.,That language isn't good anymore.
Unyil emun korun patin ba koi te.,Unyil's mother has a wound on her foot and then there was pus.
Ma jiere kilo konde ripi puraman?,He bought for how many thousand rupiah per kilo?
Mu he mat tangkapte kuru mia.,They are catching him and bringing him.
Ka me orkore!,"""You go in the stern!"""
Ka nenggap teba?,What are you doing?
Bakri ma tebol mulunggara sor karop.,Bakri is shooting fish at the reef edge.
Tomi emun ma bo Mas wilaunggoa tebolsuban.,Tomi's mother went fishing at the reef edge at Mas.
Nabil esun ma warat tebonggani di Maryam emunggi.,Nabil's father gave all coconuts to Maryam's mother.
"Mu tok yarat teiret, kewewaruotkin.",They are making a foundation; they want to make a house.
Ayah Tok yatal teir teba.,Ayah Tok is making a stone wall.
Pas osat teitei in koi osat di timbangunggo.,The woman steps on the sand and then we put sand on her forehead.
Maryam emun Walakangga bara ma tektek koni an.,Maryam's mother came back from Gorom and gave me a knife.
Tel epka wa me pi kurang koluk.,Lately we don't find tell shells so much.
Rajiba emun ma kanaia potma ba kanai telebor.,Rajiba's mother was cutting pili nuts but they rolled away.
Manado telelengguesat koni ramie.,Manadu caught a wrasse.
Kokok ma me an mat komain ba ma telin.,"That chicken, I threw something at it but it stayed."
Suo me teltel mambon.,At Suo there are teltel roots.
Tonggarai Karimun me teltel reidak.,At Cape Tonggarai there are many vase shells.
Afokat yume ur koura ma teltel.,"That avocado, when the wind blows it moves."
Rum temtemun.,A big tefar fish.
Ma rortem siunggo mambaran.,He stands on the fallen stem of the tree.
Sakina ladanun ma me se bo temun.,Sakina's shirt is very big.
Tumun temun kon cicaun kon. Temun toni kasuret me...,There's one big child and one small child. The big one says tomorrow...
Kiba esun et rorun se ten.,The wood of Kiba's father's canoe has gone bad.
Muap koturtenara ka nanan.,You ate dirty food.
Sontum sorat sanggaratninden pitisun saerak.,People don't go fishing (so) there is no money.
Mayor et tenaun tabili he nan.,The snails ate the keel of Mayor's canoe.
Kukis me se tenenun.,These cookies are old.
Rustam taraun walorteng so reba.,Rustam's grandmother is peeling midribs.
Tenggeleles kona ror karo melalu owa.,A brahmini kits sits on a branch over there.
Sontum mahap owatko tengguen.,All people are gathered over there.
Bal kokoat nara tengun owatko.,A dog ate a chicken; its feathers are over there.
Mosun teok.,The foggy season.
Afokat wa me se tep.,This avocado already fruits.
Tumun im tewiri na.,The child eats two bananas.
Tepner me paransik.,The deep water is close.
